{
  "kind": "data-model",
  "version": "0.1",
  "id": "sales-star",
  "title": "Sales star schema",
  "layout": "star",
  "entities": [
    { "id": "sales", "type": "fact", "name": "Sales", "grain": "One row per order line", "columns": [
      { "name": "SalesKey", "role": "pk" },
      { "name": "DateKey", "role": "fk" },
      { "name": "ProductKey", "role": "fk" },
      { "name": "CustomerKey", "role": "fk" },
      { "name": "SalesAmount", "role": "measure" }
    ] },
    { "id": "dates", "type": "dimension", "name": "Dates", "columns": [{ "name": "DateKey", "role": "pk" }, { "name": "Date", "role": "attribute" }] },
    { "id": "products", "type": "dimension", "name": "Products", "columns": [{ "name": "ProductKey", "role": "pk" }, { "name": "ProductName", "role": "attribute" }] },
    { "id": "customers", "type": "dimension", "name": "Customers", "columns": [{ "name": "CustomerKey", "role": "pk" }, { "name": "CustomerName", "role": "attribute" }] }
  ],
  "relationships": [
    { "from": "sales.DateKey", "to": "dates.DateKey", "cardinality": "many-to-one", "filterDirection": "single" },
    { "from": "sales.ProductKey", "to": "products.ProductKey", "cardinality": "many-to-one", "filterDirection": "single" },
    { "from": "sales.CustomerKey", "to": "customers.CustomerKey", "cardinality": "many-to-one", "filterDirection": "single" }
  ]
}
